{
  "id": "metropolis",
  "name": "Metropolis",
  "population": 500000,
  "demographics": {
    "low":    0.45,
    "middle": 0.40,
    "high":   0.15
  },
  "grid": {
    "width":  80,
    "height": 80
  },
  "geography": {
    "coastal":     true,
    "arable":      true,
    "mineralRich": false,
    "oilRich":     false
  },
  "baseLandPrice": 150.0
}
