{
  "id": "hilltown",
  "name": "Hilltown",
  "population": 100000,
  "demographics": {
    "low": 0.2,
    "middle": 0.4,
    "high": 0.4
  },
  "grid": {
    "width": 40,
    "height": 40
  },
  "geography": {
    "coastal": false,
    "arable": true,
    "mineralRich": false,
    "oilRich": false
  },
  "baseLandPrice": 250.0,
  "wageIndex": 1.0
}
